{
  "schema": "asset-forge/production-request/v1",
  "requestId": "live-vector-smoke",
  "instruction": "Create a clean simple geometric game UI icon with no text, no watermark, and a transparent or empty background.",
  "manifest": {
    "id": "live-vector-icon",
    "project": "asset-forge-live-smoke",
    "type": "icon",
    "importance": "primary",
    "source": {"mode": "generated"},
    "license": {
      "id": "project-owned",
      "commercialUse": true,
      "derivatives": true,
      "attributionRequired": false
    },
    "target": {
      "engine": null,
      "format": "svg",
      "maxBytes": 1048576
    },
    "constraints": {}
  },
  "delivery": {
    "engine": null,
    "outputDir": "build/live-vector-smoke"
  }
}
