{
  "schema": "asset-forge/production-request/v1",
  "requestId": "live-raster-smoke",
  "instruction": "Create a simple isolated sci-fi energy cell game sprite with a dark metallic body, one cyan emissive strip, no text, no watermark, and a plain neutral background.",
  "manifest": {
    "id": "live-raster-cell",
    "project": "asset-forge-live-smoke",
    "type": "sprite",
    "importance": "secondary",
    "source": {"mode": "generated"},
    "license": {
      "id": "project-owned",
      "commercialUse": true,
      "derivatives": true,
      "attributionRequired": false
    },
    "target": {
      "engine": null,
      "format": "png",
      "maxBytes": 4194304
    },
    "constraints": {
      "frameWidth": 96,
      "frameHeight": 96,
      "expectedFrames": 1
    }
  },
  "delivery": {
    "engine": null,
    "outputDir": "build/live-raster-smoke"
  }
}
